{
  "bgm": {
    "allow_sources": [
      "youtube_audio_library"
    ],
    "avoid": [
      "vocal",
      "too_loud",
      "copyright_risky"
    ],
    "enabled": true,
    "fade_in_ms": 500,
    "fade_out_ms": 1200,
    "intensity": "low",
    "mood": "mysterious",
    "strategy": "youtube_safe_bgm",
    "volume_db": -26
  },
  "fact_check_notes": "公開前に潜水艦塗装の一般論として確認する。",
  "hook": "深海では黒い潜水艦が、想像以上に見つかりにくくなります。",
  "id": "trivia_submarine_black_001",
  "manual_fact_check_required": true,
  "platform_profile": "youtube_shorts",
  "production_notes": "初期MVP確認用サンプル。",
  "schema_version": "youtube-1.0.0",
  "script": [
    {
      "caption_style_hint": "normal",
      "estimated_duration_sec": 3.5,
      "index": 1,
      "text": "深海では、太陽の光がほとんど届きません。",
      "visual_query": "dark deep ocean"
    },
    {
      "caption_style_hint": "emphasis",
      "estimated_duration_sec": 4.5,
      "index": 2,
      "text": "だから黒い物体は、背景の暗さに溶け込みやすくなります。",
      "visual_query": "black submarine underwater"
    },
    {
      "caption_style_hint": "punchline",
      "estimated_duration_sec": 5.0,
      "index": 3,
      "text": "潜水艦の色は、見た目よりも任務と環境に合わせて選ばれます。",
      "visual_query": "submarine underwater silhouette"
    }
  ],
  "target": {
    "aspect_ratio": "9:16",
    "duration_sec": 18,
    "fps": 30,
    "resolution": {
      "height": 1920,
      "width": 1080
    },
    "video_format": {
      "audio_codec": "aac",
      "container": "mp4",
      "pix_fmt": "yuv420p",
      "video_codec": "libx264"
    }
  },
  "title": "深海と黒い潜水艦",
  "topic": "深海で黒く見える潜水艦の雑学",
  "visual_strategy": {
    "avoid_keywords": [
      "aquarium",
      "toy"
    ],
    "fallback": "crop_landscape_to_9_16",
    "fallback_queries": [
      "dark ocean",
      "underwater light",
      "deep sea"
    ],
    "preferred_orientation": "portrait",
    "primary_query": "deep ocean submarine",
    "source_priority": [
      "pexels",
      "local"
    ]
  },
  "voice": {
    "engine": "aivis_speech",
    "intonation_scale": 1.0,
    "pitch_scale": 0.0,
    "sentence_gap_ms": 180,
    "speaker": "まお",
    "speed_scale": 1.0,
    "style_id": 888753760
  },
  "youtube": {
    "analytics_hypothesis": {
      "experiment_group": "sample_mysterious_low",
      "hypothesis": "冒頭で深海の意外性を出すと視聴維持率が上がる。",
      "primary_metric": "average_view_percentage",
      "secondary_metrics": [
        "views",
        "likes"
      ]
    },
    "category_hint": "education",
    "contains_synthetic_voice": true,
    "description": "深海と潜水艦の色に関する短い雑学です。",
    "description_sections": {
      "credits_policy": "include_pexels_and_bgm_credits",
      "disclaimer": "投稿前に内容のファクトチェックを行ってください。",
      "summary": "深海では光が少ないため、黒い物体は背景に溶け込みやすくなります。"
    },
    "hashtags": [
      "#雑学",
      "#潜水艦",
      "#Shorts"
    ],
    "made_for_kids": false,
    "privacy_status": "private",
    "tags": [
      "雑学",
      "潜水艦",
      "深海"
    ],
    "title": "深海で黒い潜水艦が見つかりにくい理由 #Shorts"
  }
}
