{
  "bgm": {
    "allow_sources": [
      "youtube_audio_library"
    ],
    "avoid": [
      "vocal",
      "too_loud",
      "copyright_risky"
    ],
    "enabled": true,
    "fade_in_ms": 500,
    "fade_out_ms": 1200,
    "intensity": "low",
    "mood": "mysterious",
    "strategy": "youtube_safe_bgm",
    "volume_db": -26
  },
  "fact_check_notes": "暗順応、反射、光害の説明が一般向けに妥当か確認する。",
  "hook": "夜の街が明るく感じるのは、電気の数だけが理由ではありません。",
  "id": "trivia_city_lights_night_001",
  "manual_fact_check_required": true,
  "platform_profile": "youtube_shorts",
  "production_notes": "3本品質チェック用の夜の街テーマ台本。",
  "schema_version": "youtube-1.0.0",
  "script": [
    {
      "caption_style_hint": "normal",
      "estimated_duration_sec": 3.5,
      "index": 1,
      "text": "夜の街は、空が暗いほど明るく見えます。",
      "visual_query": "city night lights"
    },
    {
      "caption_style_hint": "question",
      "estimated_duration_sec": 4.0,
      "index": 2,
      "text": "その理由は、ただ電気が多いからだけではありません。",
      "visual_query": "neon city street"
    },
    {
      "caption_style_hint": "normal",
      "estimated_duration_sec": 4.0,
      "index": 3,
      "text": "人間の目は、暗い場所では光に敏感になります。",
      "visual_query": "human eye close up"
    },
    {
      "caption_style_hint": "normal",
      "estimated_duration_sec": 4.2,
      "index": 4,
      "text": "小さな看板の光でも、昼よりずっと強く感じます。",
      "visual_query": "neon sign night"
    },
    {
      "caption_style_hint": "normal",
      "estimated_duration_sec": 4.0,
      "index": 5,
      "text": "さらに、街の光は道路や窓に反射します。",
      "visual_query": "wet street reflections"
    },
    {
      "caption_style_hint": "emphasis",
      "estimated_duration_sec": 5.2,
      "index": 6,
      "text": "雨の日の夜道がきらきら見えるのは、この反射が増えるからです。",
      "visual_query": "rainy city night"
    },
    {
      "caption_style_hint": "normal",
      "estimated_duration_sec": 4.5,
      "index": 7,
      "text": "光はまっすぐ進むだけでなく、いろいろな方向にはね返ります。",
      "visual_query": "light reflection glass"
    },
    {
      "caption_style_hint": "normal",
      "estimated_duration_sec": 5.0,
      "index": 8,
      "text": "だから実際の電灯の数より、街全体が明るく感じられます。",
      "visual_query": "urban night skyline"
    },
    {
      "caption_style_hint": "question",
      "estimated_duration_sec": 3.2,
      "index": 9,
      "text": "でも、明るすぎる夜には問題もあります。",
      "visual_query": "bright city night"
    },
    {
      "caption_style_hint": "emphasis",
      "estimated_duration_sec": 4.0,
      "index": 10,
      "text": "星が見えにくくなる、光害という現象です。",
      "visual_query": "light pollution sky"
    },
    {
      "caption_style_hint": "normal",
      "estimated_duration_sec": 5.2,
      "index": 11,
      "text": "本来なら見えるはずの星の光が、街の明かりに埋もれてしまいます。",
      "visual_query": "stars over city"
    },
    {
      "caption_style_hint": "normal",
      "estimated_duration_sec": 5.5,
      "index": 12,
      "text": "つまり夜景の美しさは、便利さと引き換えに生まれている面もあります。",
      "visual_query": "city lights aerial night"
    },
    {
      "caption_style_hint": "emphasis",
      "estimated_duration_sec": 5.8,
      "index": 13,
      "text": "私たちが見ている夜の街は、電気と反射と目の働きが作る景色です。",
      "visual_query": "night city timelapse"
    },
    {
      "caption_style_hint": "punchline",
      "estimated_duration_sec": 5.2,
      "index": 14,
      "text": "暗闇の中で光る街は、人間が作ったもうひとつの星空なのです。",
      "visual_query": "city skyline night lights"
    }
  ],
  "target": {
    "aspect_ratio": "9:16",
    "duration_sec": 60,
    "fps": 30,
    "resolution": {
      "height": 1920,
      "width": 1080
    },
    "video_format": {
      "audio_codec": "aac",
      "container": "mp4",
      "pix_fmt": "yuv420p",
      "video_codec": "libx264"
    }
  },
  "title": "夜の街が明るく見える理由",
  "topic": "夜の街が明るく見える理由",
  "visual_strategy": {
    "avoid_keywords": [
      "cartoon",
      "illustration",
      "toy"
    ],
    "fallback": "crop_landscape_to_9_16",
    "fallback_queries": [
      "neon city street",
      "rainy city night",
      "urban night skyline",
      "city skyline night lights"
    ],
    "preferred_orientation": "portrait",
    "primary_query": "city night lights",
    "source_priority": [
      "pexels",
      "local"
    ]
  },
  "voice": {
    "engine": "aivis_speech",
    "intonation_scale": 1.0,
    "pitch_scale": 0.0,
    "sentence_gap_ms": 180,
    "speaker": "まお",
    "speed_scale": 1.22,
    "style_id": 888753760
  },
  "youtube": {
    "analytics_hypothesis": {
      "experiment_group": "city_lights_night_mysterious_low",
      "hypothesis": "夜景の美しさから光害へ展開すると、身近さと意外性で視聴維持しやすい。",
      "primary_metric": "average_view_percentage",
      "secondary_metrics": [
        "views",
        "likes"
      ]
    },
    "category_hint": "education",
    "contains_synthetic_voice": true,
    "description": "夜の街が明るく感じる理由を、目の働きと光の反射から短く紹介します。",
    "description_sections": {
      "credits_policy": "include_pexels_and_bgm_credits",
      "disclaimer": "投稿前に目の働きと光害に関する表現を確認してください。",
      "summary": "夜景が明るく見える理由を、暗順応、反射、光害の観点で説明します。"
    },
    "hashtags": [
      "#雑学",
      "#夜景",
      "#Shorts"
    ],
    "made_for_kids": false,
    "privacy_status": "private",
    "tags": [
      "雑学",
      "夜景",
      "光",
      "光害"
    ],
    "title": "夜の街が明るく見える理由 #Shorts"
  }
}
